{
  "schema_version": "3.0.0",
  "case_id": "Ce8e57f3e923d66db",
  "domain": "OM",
  "anonymized_passage": "before staffing a time-limited service window, before customer arrivals and service durations is known, a service-operations manager sets staffing for the window using arrival-rate estimates, service-time estimates, wage cost, and delay penalties. The stated objective is to minimize expected staffing and delay cost, subject to the condition that staff cannot be added after the cutoff in the stated model. Several operational considerations connect the decision to later outcomes, but their relationship is not specified. The decision is important and involves competing considerations that require further analysis. The scope of the resulting claim remains to be established. The study identifies the conditions under which one additional server has the greatest operational value.",
  "passage_function": "managerial_implications",
  "context": {
    "model_or_study_facts": [
      "staff cannot be added after the cutoff in the stated model",
      "customer arrivals and service durations"
    ],
    "actor": "a service-operations manager",
    "decisions": [
      "sets staffing for the window"
    ],
    "objective": "minimize expected staffing and delay cost",
    "timing": "before staffing a time-limited service window",
    "decision_time_information": [
      "arrival-rate estimates, service-time estimates, wage cost, and delay penalties"
    ],
    "constraints": [
      "staff cannot be added after the cutoff in the stated model"
    ],
    "mechanism": "Staffing changes congestion, waiting, and abandonment through available service capacity",
    "supplied_evidence": [
      "Synthetic illustration; no external empirical evidence supplied."
    ]
  },
  "intended_audience": "business and research readers",
  "requested_evaluation_profile": "standard"
}
