{
  "schema_version": "3.0.0",
  "case_id": "C0372818311a7b64c",
  "domain": "IS",
  "anonymized_passage": "before classifying a new content item, before the item's harmfulness and classifier error is known, a moderation policy owner sets a review threshold using privacy-permitted signals using approved signal features, error costs, and reviewer capacity. The stated objective is to minimize expected moderation harm and review cost, subject to the condition that privacy-restricted attributes are unavailable unless consent and policy permit their use. Several operational considerations connect the decision to later outcomes, but their relationship is not specified. The decision is important and involves competing considerations that require further analysis. The scope of the resulting claim remains to be established. The study asks how privacy limits alter the value of selective human review.",
  "passage_function": "research_opportunity",
  "context": {
    "model_or_study_facts": [
      "privacy-restricted attributes are unavailable unless consent and policy permit their use",
      "the item's harmfulness and classifier error"
    ],
    "actor": "a moderation policy owner",
    "decisions": [
      "sets a review threshold using privacy-permitted signals"
    ],
    "objective": "minimize expected moderation harm and review cost",
    "timing": "before classifying a new content item",
    "decision_time_information": [
      "approved signal features, error costs, and reviewer capacity"
    ],
    "constraints": [
      "privacy-restricted attributes are unavailable unless consent and policy permit their use"
    ],
    "mechanism": "The threshold routes uncertain items to review and changes false-positive and false-negative exposure",
    "supplied_evidence": [
      "Synthetic illustration; no external empirical evidence supplied."
    ]
  },
  "intended_audience": "business and research readers",
  "requested_evaluation_profile": "standard"
}
