{
  "schema_version": "3.0.0",
  "case_id": "C2a4e6db9f5b680a8",
  "domain": "OM",
  "anonymized_passage": "before products are displayed for the next selling period, before the arriving customer's initial product and subsequent substitution path is known, an assortment planner selects products under a fixed display-slot limit using product margins and a specified Markov substitution matrix. The stated objective is to maximize expected assortment revenue, subject to the condition that display capacity is distinct from inventory and fulfillment capacity. When a preferred product is absent, the stated transition matrix redirects demand among displayed alternatives or to exit. Adding variety captures more first choices but consumes slots that could support stronger substitution paths. The universally superior policy will transform the market and guarantee better performance. The analysis identifies which transition patterns make a scarce slot most valuable.",
  "passage_function": "model_setting",
  "context": {
    "model_or_study_facts": [
      "display capacity is distinct from inventory and fulfillment capacity",
      "the arriving customer's initial product and subsequent substitution path"
    ],
    "actor": "an assortment planner",
    "decisions": [
      "selects products under a fixed display-slot limit"
    ],
    "objective": "maximize expected assortment revenue",
    "timing": "before products are displayed for the next selling period",
    "decision_time_information": [
      "product margins and a specified Markov substitution matrix"
    ],
    "constraints": [
      "display capacity is distinct from inventory and fulfillment capacity"
    ],
    "mechanism": "When a preferred product is absent, the stated transition matrix redirects demand among displayed alternatives or to exit",
    "supplied_evidence": [
      "Synthetic illustration; no external empirical evidence supplied."
    ]
  },
  "intended_audience": "business and research readers",
  "requested_evaluation_profile": "standard"
}
